{
  "$schema": "https://json-schema.org/draft/2020-12/schema",
  "$id": "aa://eval/eval-dataset-card.schema.json",
  "type": "object",
  "required": [
    "datasetId",
    "divisionId",
    "scenarioId",
    "version",
    "source",
    "taskCount",
    "split",
    "samples",
    "sampleCount",
    "contaminationStatus",
    "contaminationEvidence",
    "privacyStatus",
    "labelingMethod",
    "allowedForTraining",
    "allowedForReleaseGate",
    "retentionPolicyRef",
    "frozenHash"
  ],
  "properties": {
    "datasetId": { "type": "string" },
    "divisionId": { "type": "string" },
    "scenarioId": { "type": "string" },
    "version": { "type": "string" },
    "source": { "type": "string" },
    "taskCount": { "type": "integer", "minimum": 1 },
    "split": { "type": "string", "enum": ["train", "heldout", "release", "shadow"] },
    "samples": { "type": "string", "minLength": 1 },
    "sampleCount": { "type": "integer", "minimum": 1 },
    "contaminationStatus": { "type": "string", "enum": ["clean", "suspected", "unknown"] },
    "contaminationEvidence": {
      "type": "array",
      "items": { "type": "string", "minLength": 1 },
      "minItems": 1
    },
    "privacyStatus": { "type": "string", "enum": ["public", "internal", "redacted", "restricted"] },
    "labelingMethod": { "type": "string" },
    "allowedForTraining": { "type": "boolean" },
    "allowedForReleaseGate": { "type": "boolean" },
    "retentionPolicyRef": {
      "type": "string",
      "pattern": "^training-data-policy/[A-Za-z0-9._/-]+\\.ya?ml$"
    },
    "frozenHash": {
      "type": "string",
      "pattern": "^sha256:[a-f0-9]{64}$"
    }
  },
  "additionalProperties": false
}
