{
  "datasetId": "tau-style-heldout-v1",
  "divisionId": "customer-service",
  "scenarioId": "customer-refund-policy",
  "version": "2026.06",
  "source": "redacted_support_cases",
  "taskCount": 121,
  "split": "heldout",
  "samples": "eval/datasets/tau-style/samples",
  "sampleCount": 121,
  "contaminationStatus": "clean",
  "contaminationEvidence": [
    "docs_zh/divisions/customer-service/leadership-evidence/eval-report.md"
  ],
  "privacyStatus": "redacted",
  "labelingMethod": "policy_team_review",
  "allowedForTraining": false,
  "allowedForReleaseGate": true,
  "retentionPolicyRef": "training-data-policy/retention.yaml",
  "frozenHash": "sha256:981906d7e8d63e5f6a22a1d7592bef5cdf9677c923bbeb61fd1292e8521872d7"
}
